id,name,instructions,videoUrl,image,muscleGroups,generalMuscleGroups,injuryRisks,category,isTimed,difficulty,caloriesPerMinute,setsRange,repsRange,restTimeSeconds,exerciseType,movementPattern,specificEquipment,targetIntensity,workoutPhase,recommendedDurationSeconds,minimumEquipmentAlternative,genderAdjustment,pairWith
rest,Rest,"Take a rest day to recover. Focus on light stretching, hydration, and mobility work if desired. Avoid intense physical activity to allow your muscles to repair and grow stronger.",,assets/images/incline_barbell_press.jpg,,,Rest,Rest,FALSE,Beginner,0,0,0,0,Rest,Rest,None,Low,Rest,,,None,04
smith_machine_shoulder_press,Smith Machine Shoulder Press,"Set up a bench in the Smith machine with a vertical backrest. Sit upright, feet flat on the floor, and grasp the bar with an overhand grip, hands slightly wider than shoulder-width, just above your shoulders. Unhook the bar by rotating your wrists. Inhale to brace your core, then exhale as you press the bar overhead until your arms are fully extended but not locked out. Keep your head facing forward and avoid arching your back. Inhale as you lower the bar back to the starting position, stopping just above your shoulders. Maintain control throughout the movement to avoid bouncing the bar.",,,Front Shoulder;Mid Shoulder,Shoulders,Shoulders,Gym,FALSE,Intermediate,6,03-04,08-12,60,Compound,Push,Smith Machine,Moderate,Main,,seated_dumbbell_shoulder_press,More Upper Body for Men,seated_cable_row
reverse_snow_angels,Reverse Snow Angels,"Lie face down on a mat with your arms at your sides, holding light dumbbells in each hand, palms facing up. Engage your core and squeeze your glutes to stabilize your body. Keep your legs on the ground and your neck in a neutral position. Exhale as you slowly lift your chest and arms off the ground, keeping your arms straight. Move your arms out to the sides to form a T-shape with your body, then continue upward to form a Y-shape overhead. As you move, rotate your shoulders so your palms face down at the top of the movement. Inhale as you reverse the motion, bringing your arms back to your sides, then lower your chest and arms to the starting position. Avoid shrugging your shoulders or overarching your lower back.",,,Upper Back;Mid Back;Rear Shoulder,Back;Shoulders,Shoulders,dumbbells,FALSE,Intermediate,5,03-04,08-12,60,Accessory,Pull,Dumbbells,Moderate,Accessory,,superman_hold,More Upper Body for Men,chest_dumbbell_pullover
close_grip_ez_bar_curl,Close Grip EZ Bar Curl,"Stand with your feet shoulder-width apart, knees slightly bent for stability. Grasp an EZ bar with a close underhand grip (hands closer than shoulder-width), arms fully extended, and the bar resting against your thighs. Keep your torso upright, shoulders back, and elbows tucked into your sides. Exhale as you curl the bar toward your chest, focusing on contracting your biceps and keeping your elbows stationary. Pause briefly at the top, squeezing your biceps, then inhale as you slowly lower the bar back to the starting position. Avoid swinging your body or letting your elbows flare out.",,,Short Head Biceps,Arms,Elbows,Gym,FALSE,Intermediate,5,03-04,08-12,60,Accessory,Pull,EZ Bar,Moderate,Accessory,,bicep_dumbbell_curls,Lighter Weight for Women,overhead_rope_extension
ez_bar_curl,EZ Bar Curl,"Stand tall with your feet shoulder-width apart, holding an EZ bar with an underhand grip, hands shoulder-width apart. Let the bar rest against your thighs, keeping your elbows tucked into your sides and your torso stationary. Exhale as you curl the bar up toward your chest, focusing on squeezing your biceps at the top of the movement. Keep your wrists straight and avoid using momentum by swinging your body. Inhale as you slowly lower the bar back to the starting position, maintaining tension in your biceps. Do not let the bar rest on your thighs at the bottom.",,assets/images/ez_bar_curl.jpg,Long Head Biceps;Short Head Biceps,Arms,Elbows,Gym,FALSE,Intermediate,5,03-,08-12,60,Accessory,Pull,EZ Bar,Moderate,Accessory,,bicep_dumbbell_curls,Lighter Weight for Women,skullcrushers
cable_flies,Cable Flies,"Set the cable machine pulleys to chest height. Stand in the center, grabbing a handle in each hand with an overhand grip. Step forward into a staggered stance (one foot slightly ahead), keeping a slight bend in your elbows. Engage your core and maintain a slight forward lean. Exhale as you squeeze your chest muscles and bring the handles together in front of your chest, arms forming a wide arc. Pause briefly when the handles meet, then inhale as you slowly return to the starting position, keeping the movement controlled. Avoid letting your shoulders shrug or your back arch excessively.",,,Mid Chest,Chest,Shoulders,Gym,FALSE,Intermediate,6,03-04,08-12,60,Accessory,Push,Cable,Moderate,Main,,dumbbell_fly,More Upper Body for Men,seated_cable_row
seated_tricep_extension,Seated Tricep Extension,"Set an adjustable bench to a 90-degree angle and sit upright, feet flat on the floor. Hold a dumbbell with both hands by gripping the handle, palms facing up, and lift it overhead so your arms are fully extended. Keep your core engaged and elbows close to your head, pointing forward. Inhale as you slowly lower the dumbbell behind your head by bending your elbows, keeping your upper arms stationary. Lower until your forearms are parallel to the ground or just below. Exhale as you extend your arms back to the starting position, fully contracting your triceps. Avoid flaring your elbows out or arching your back.",,,Long Head Triceps;Lateral Head Triceps;Medial Head Triceps,Arms,Shoulders,dumbbells,FALSE,Intermediate,5,03-04,08-12,60,Accessory,Push,Dumbbells,Moderate,Accessory,,overhead_dumbbell_extension,More Upper Body for Men,incline_dumbbell_curl
back_dumbbell_pullover,Back Dumbbell Pullover,"Lie perpendicular on a flat bench with only your upper back and shoulders on the bench, feet flat on the floor, and hips lowered toward the ground. Hold a dumbbell with both hands above your chest, gripping the handle, palms facing up, with a slight bend in your elbows. Engage your core to keep your hips stable. Inhale as you slowly lower the dumbbell back over your head in an arc, feeling a stretch in your lats and upper back. Lower until your arms are parallel to the floor, then exhale as you pull the dumbbell back to the starting position, squeezing your lats. Keep your hips steady and avoid overarching your lower back.",,assets/images/dumbbell_pullover.jpg,Lats;Upper Back,Back,Shoulders,dumbbells,FALSE,Intermediate,5,03-04,08-12,60,Accessory,Pull,Dumbbells,Moderate,Main,,dumbbell_pullover,More Upper Body for Men,flat_dumbbell_press
chest_dumbbell_pullover,Chest Dumbbell Pullover,"Lie flat on a bench with your feet planted on the ground. Hold a dumbbell with both hands above your chest, gripping the handle, palms facing each other, and elbows slightly bent. Engage your core and keep your back flat against the bench. Inhale as you slowly lower the dumbbell back over your head in a controlled arc, keeping your arms stable and feeling a stretch in your chest. Lower until the dumbbell is parallel to the floor, then exhale as you return to the starting position, squeezing your chest at the top. Avoid letting your lower back arch or your elbows flare out excessively.",,,Mid Chest,Chest,Shoulders,dumbbells,FALSE,Intermediate,5,03-04,08-12,60,Accessory,Push,Dumbbells,Moderate,Main,,dumbbell_fly,More Upper Body for Men,reverse_snow_angels
smith_machine_calve_raises,Smith Machine Calve Raises,"Place a weight plate or sturdy step in the center of the Smith machine, ensuring it’s stable. Step onto the plate with the balls of your feet, keeping your heels off the edge, and position the Smith bar across your upper back as you would for a back squat. Unrack the bar by rotating your wrists, keeping your legs straight but not locked. Inhale as you lower your heels toward the floor, feeling a stretch in your calves. Exhale as you press through the balls of your feet, raising your heels as high as possible and squeezing your calves at the top. Pause briefly, then lower back down with control. Ensure the bar stays balanced and avoid bouncing at the bottom.",,,Calves,Legs,Ankles,Gym,FALSE,Intermediate,5,03-04,08-12,60,Accessory,Other,Smith Machine,Moderate,Accessory,,standing_calf_raises,None,
skullcrushers,Skullcrushers,"Lie flat on a bench with your feet planted on the ground, holding an EZ bar or barbell with an overhand grip, hands shoulder-width apart. Extend your arms straight up over your chest, keeping your wrists strong. Inhale as you slowly lower the bar toward your forehead by bending your elbows, keeping your upper arms perpendicular to the floor and elbows tucked in. Stop when the bar is about an inch above your forehead. Exhale as you extend your arms back to the starting position, fully contracting your triceps. Avoid moving your upper arms or letting your elbows flare out.",,,Long Head Triceps;Medial Head Triceps,Arms,Elbows,Gym,FALSE,Intermediate,5,03-04,08-12,60,Accessory,Push,EZ Bar,Moderate,Accessory,,tricep_dips,More Upper Body for Men,ez_bar_curl
powerlifting_squat,Powerlifting Squat,"Position a barbell in a squat rack at a height just below your shoulders. Step under the bar and place it across your upper back, either in a high-bar position (on your traps) or low-bar position (on your rear delts). Grip the bar firmly, hands slightly wider than shoulder-width, and unrack it by standing up. Step back and set your feet slightly wider than shoulder-width, toes pointed out 15-30 degrees. Inhale deeply to brace your core, pull your shoulder blades back, and keep your chest up. Begin the squat by pushing your hips back and bending your knees, keeping your knees tracking over your toes and your back neutral. Lower until your hips are at least parallel to your knees, then exhale as you drive through your heels to stand back up, squeezing your glutes at the top. Avoid letting your knees cave inward or your back round.",,,Quads;Hamstrings;Glutes,Legs;Glutes,Knees;Lower Back,Gym,FALSE,Advanced,7,04-May,06-10,90,Compound,Squat,Barbell,High,Main,,smith_machine_squat,More Lower Body for Women,deadlift
cardio,Cardio,"Choose a cardio activity such as running, cycling, swimming, rowing, or using an elliptical machine. Perform at a moderate intensity where you can still talk but feel your heart rate elevated. Aim for a steady pace, keeping your posture upright and breathing steady. For example, if running, land softly on your midfoot and avoid overstriding. If cycling, maintain a smooth pedal stroke and avoid hunching your shoulders. Adjust intensity based on your fitness level.",,assets/images/flat_dumbbell_press.jpg,Full Body,Full Body,,Cardio,FALSE,Intermediate,10,03-04,20-30 minutes,60,Compound,Other,Cardio Equipment,Moderate,Main,,jump_rope,None,
overhead_rope_extension,Overhead Rope Extension,"Attach a rope to the bottom pulley of a cable machine. Stand facing away from the machine, feet shoulder-width apart, and grab the rope with both hands, palms facing each other. Extend your arms overhead, keeping your elbows close to your head and pointing upward. Engage your core to avoid arching your back. Inhale as you lower the rope behind your head by bending your elbows, feeling a stretch in your triceps. Exhale as you extend your arms back to the starting position, fully contracting your triceps. Keep your upper arms stationary and avoid letting your elbows flare out.",,,Long Head Triceps;Medial Head Triceps,Arms,Elbows,Gym,FALSE,Intermediate,5,03-04,08-12,60,Accessory,Push,Cable,Moderate,Accessory,,tricep_pushdown_rope,More Upper Body for Men,close_grip_ez_bar_curl
seated_shoulder_press,Seated Shoulder Press,"Set an adjustable bench to a 90-degree angle and sit with your back fully supported, feet flat on the floor. Hold a dumbbell in each hand at shoulder height, palms facing forward, elbows bent at 90 degrees and pointing downward. Engage your core and keep your chest up. Exhale as you press the dumbbells overhead, bringing them close together at the top without locking your elbows. Inhale as you lower the dumbbells back to shoulder height, keeping your elbows at a 45-degree angle to your torso. Avoid shrugging your shoulders or arching your back during the movement.",,,Front Shoulder;Mid Shoulder,Shoulders,Shoulders,dumbbells,FALSE,Intermediate,6,03-04,08-12,60,Compound,Push,Dumbbells,Moderate,Main,,seated_dumbbell_shoulder_press,More Upper Body for Men,chest_supported_dumbbell_row
close_grip_lat_pull_down,Close Grip Lat Pull Down,"Sit at a lat pull-down machine and adjust the seat so your thighs are secured under the pads. Attach a V-handle or close-grip bar and grasp it with a neutral or underhand grip, hands closer than shoulder-width. Sit upright, feet flat on the floor, and engage your core. Lean back slightly (about 20 degrees) and pull your shoulder blades down and back. Exhale as you pull the handle down to the top of your chest, driving your elbows down and squeezing your lats. Pause briefly, then inhale as you return the handle to the starting position with control. Avoid arching your back or using momentum to pull the weight.",,,Lats;Mid Back,Back,Shoulders,Gym,FALSE,Intermediate,6,03-04,08-12,60,Compound,Pull,Cable,Moderate,Main,,seated_cable_row,More Upper Body for Men,incline_smith_machine_bench_press
tricep_bench_dips,Tricep Bench Dips,"Sit on the edge of a bench with your hands gripping the edge, fingers pointing forward, and feet flat on the floor, knees bent at 90 degrees (or legs extended for more challenge). Slide your hips off the bench, keeping your arms straight and shoulders away from your ears. Inhale as you bend your elbows to lower your body, stopping when your upper arms are parallel to the ground or you feel a stretch in your shoulders. Exhale as you press through your hands to extend your arms and return to the starting position, focusing on your triceps. Keep your torso upright and avoid shrugging your shoulders.",,,Long Head Triceps,Arms,Shoulders;Wrists,Bodyweight,FALSE,Intermediate,4,03-04,08-12,60,Accessory,Push,Bodyweight,Moderate,Accessory,,tricep_dips,More Upper Body for Men,bicep_push_ups
face_pull,Face Pull,"Set a cable machine with a rope attachment at upper chest height. Stand facing the machine, feet shoulder-width apart, and grab the rope with both hands, palms facing each other. Step back until your arms are fully extended, then lean back slightly (about 20 degrees) and engage your core. Pull the rope toward your face, flaring your elbows out to the sides and aiming the handles toward your forehead. Squeeze your rear delts and upper back at the end of the movement, then slowly return to the starting position. Keep your shoulders down and avoid using your traps excessively.",,,Rear Shoulder,Shoulders,Shoulders,Gym,FALSE,Intermediate,5,03-04,08-12,60,Accessory,Pull,Cable,Moderate,Accessory,,cable_reverse_fly,More Upper Body for Men,
chin_ups,Chin Ups,"Hang from a pull-up bar with a supinated (underhand) grip, hands shoulder-width apart, arms fully extended. Engage your core and squeeze your glutes to stabilize your body. Pull your shoulder blades down and back to initiate the movement. Exhale as you pull your body up, driving your elbows down until your chin is above the bar and your lats are fully contracted. Inhale as you slowly lower yourself back to the starting position, maintaining control. Avoid swinging your body or kipping to use momentum.",,,Lats;Upper Back;Biceps,Back;Arms,Shoulders,Gym,FALSE,Advanced,6,04-May,06-10,90,Compound,Pull,Pull-Up Bar,High,Main,,pull_ups,More Upper Body for Men,12line_bench_press
single_arm_dumbbell_row,Single Arm Dumbbell Row,"Place your right knee and right hand on a flat bench, keeping your back flat and parallel to the ground. Hold a dumbbell in your left hand, letting it hang straight down, palm facing in. Engage your core and pull your shoulder blade back. Exhale as you row the dumbbell up toward your waist, driving your elbow back and keeping it close to your body. Squeeze your lats at the top, then inhale as you lower the dumbbell back to the starting position with control. Avoid rotating your torso or shrugging your shoulder.",,,Lats;Mid Back,Back,Shoulders,dumbbells,FALSE,Intermediate,5,03-04,08-12,60,Compound,Pull,Dumbbells,Moderate,Main,,seated_dumbbell_row,More Upper Body for Men,dumbbell_chest_press
single_arm_overhead_tricep_dumbbell_extension,Single Arm Overhead Tricep Dumbbell Extension,"Sit on a bench with your feet flat on the floor, holding a dumbbell in your right hand. Extend your right arm overhead, keeping your elbow close to your head and palm facing forward. Place your left hand on your hip for stability. Inhale as you bend your right elbow, lowering the dumbbell behind your head until your forearm is parallel to the ground. Exhale as you extend your arm back to the starting position, fully contracting your triceps. Keep your upper arm stationary and avoid locking your elbow at the top. Repeat on the other side.",,,Long Head Triceps,Arms,Elbows,dumbbells,FALSE,Intermediate,5,03-04,08-12,60,Accessory,Push,Dumbbells,Moderate,Accessory,,single_arm_overhand_extension,More Upper Body for Men,incline_dumbbell_curl
barbell_overhead_press,Barbell Overhead Press,"Stand with your feet shoulder-width apart, holding a barbell at shoulder height with an overhand grip, hands just outside your shoulders. Engage your core and keep your chest up. Exhale as you press the bar overhead, extending your arms until they’re fully straight but not locked out. At the top, shrug your shoulders slightly to engage your traps, ensuring the bar is balanced over your midfoot. Inhale as you lower the bar back to your shoulders, keeping your elbows slightly forward. Avoid arching your lower back or leaning back excessively.",,,Front Shoulder;Mid Shoulder;Traps,Shoulders,Shoulders,Gym,FALSE,Advanced,6,04-May,06-10,90,Compound,Push,Barbell,High,Main,,smith_machine_shoulder_press,More Upper Body for Men,wide_grip_lat_pull_down
donkey_calf_raise_machine,Donkey Calf Raise Machine,"Position yourself on a donkey calf raise machine with your hips under the pad and the balls of your feet on the footplate, heels hanging off the edge. Hinge at your hips so your torso is parallel to the ground, keeping your legs straight but not locked. Inhale as you lower your heels toward the floor, feeling a stretch in your calves. Exhale as you press through the balls of your feet, raising your heels as high as possible and squeezing your calves at the top. Lower back down with control, avoiding any bouncing motion.",,,Calves,Legs,Ankles,Gym,FALSE,Intermediate,5,03-04,08-12,60,Accessory,Other,Calf Machine,Moderate,Accessory,,smith_machine_calve_raises,None,
cable_single_arm_tricep_pushdown,Cable Single Arm Tricep Pushdown,"Set a cable machine with a single handle attachment at the highest setting. Stand facing the machine, feet shoulder-width apart, and grab the handle with your right hand, palm facing down. Pin your right elbow to your side, keeping your upper arm stationary. Exhale as you push the handle down until your arm is fully extended, focusing on contracting your triceps. Inhale as you slowly return the handle to chest height, maintaining control and keeping your elbow in place. Repeat on the other side. Avoid leaning forward or using your shoulder to push the weight.",,,Long Head Triceps,Arms,Elbows,Gym,FALSE,Intermediate,5,03-04,08-12,60,Accessory,Push,Cable,Moderate,Accessory,,tricep_pushdown_rope,More Upper Body for Men,cable_bicep_curl
incline_bicep_curl,Incline Bicep Curl,"Set an incline bench to a 55-65 degree angle and sit with your back fully supported, feet flat on the floor. Hold a dumbbell in each hand, arms fully extended, palms facing up, and let your arms hang down behind your body. Keep your elbows close to your torso. Exhale as you curl the dumbbells toward your shoulders, focusing on squeezing your biceps and keeping your upper arms stationary. Inhale as you slowly lower the dumbbells back to the starting position, maintaining tension in your biceps. Avoid swinging the weights or letting your elbows flare out.",,assets/images/incline_curl.jpg,Long Head Biceps,Arms,Elbows,dumbbells,FALSE,Intermediate,5,03-04,08-12,60,Accessory,Pull,Dumbbells,Moderate,Accessory,,seated_dumbbell_bicep_curl,Lighter Weight for Women,seated_tricep_extension
barbell_curl,Barbell Curl,"Stand with your feet shoulder-width apart, holding a barbell with an underhand grip, hands shoulder-width apart. Let the bar rest against your thighs, keeping your elbows tucked into your sides and your torso upright. Exhale as you curl the bar up toward your chest, squeezing your biceps at the top of the movement. Keep your wrists straight and avoid swinging your body. Inhale as you slowly lower the bar back to the starting position, maintaining tension in your biceps. Do not let the bar rest on your thighs at the bottom.",,,Long Head Biceps;Short Head Biceps,Arms,Elbows,Gym,FALSE,Intermediate,5,03-04,08-12,60,Accessory,Pull,Barbell,Moderate,Accessory,,bicep_dumbbell_curls,Lighter Weight for Women,skullcrushers
cable_chest_press,Cable Chest Press,"Set the cable machine pulleys to chest height. Stand in the center, holding a handle in each hand with an overhand grip, and step forward into a staggered stance (one foot slightly ahead). Position your arms at a 90-degree angle, elbows in line with your shoulders, and maintain a slight forward lean. Engage your core to stabilize your spine. Exhale as you press the handles forward, bringing them together in front of your chest, fully contracting your chest muscles. Inhale as you slowly return to the starting position, keeping the movement controlled. Avoid arching your back or letting your shoulders shrug.",,,Mid Chest,Chest,Shoulders,Gym,FALSE,Intermediate,6,03-04,08-12,60,Compound,Push,Cable,Moderate,Main,,seated_machine_chest_press,More Upper Body for Men,seated_cable_row
good_morning_dumbbells,Good Morning Dumbbells,"Stand with your feet shoulder-width apart, holding a dumbbell with both hands at chest level, elbows bent. Keep a slight bend in your knees and engage your core. Inhale as you hinge at your hips, pushing your hips back and lowering your torso until it’s nearly parallel to the ground, feeling a stretch in your hamstrings. Keep your back flat and neck neutral. Exhale as you drive your hips forward to return to the starting position, squeezing your glutes at the top. Avoid rounding your back or letting your knees bend excessively.",,assets/images/good_morning.jpg,Hamstrings;Glutes;Lower Back,Legs;Glutes;Back,Lower Back,dumbbells,FALSE,Intermediate,5,03-04,08-12,60,Compound,Hinge,Dumbbells,Moderate,Main,,romanian_deadlift_dumbbells,More Lower Body for Women,leg_press
lying_tricep_extension,Lying Tricep Extension,"Lie flat on a bench with your feet planted on the floor, holding a dumbbell in each hand (or a single dumbbell with both hands). Extend your arms straight up over your chest, palms facing each other. Engage your core and squeeze your glutes to stabilize your body. Inhale as you lower the dumbbells behind your head by bending your elbows, keeping your upper arms stationary and elbows pointing toward the ceiling. Lower until your forearms are parallel to the ground, then exhale as you extend your arms back to the starting position, fully contracting your triceps. Avoid flaring your elbows or arching your back.",,,Lateral Head Triceps;Medial Head Triceps,Arms,Elbows,dumbbells,FALSE,Intermediate,5,03-04,08-12,60,Accessory,Push,Dumbbells,Moderate,Accessory,,overhead_dumbbell_extension,More Upper Body for Men,hammer_curls
seated_leg_curl_machine,Seated Leg Curl Machine,"Sit on a leg curl machine and adjust the pad so it rests just above your heels, with your thighs secured under the seat pad. Grasp the handles for stability and keep your back against the backrest. Engage your core and tense your hamstrings slightly. Exhale as you curl the weight toward your glutes, squeezing your hamstrings at the top of the movement. Inhale as you slowly return to the starting position, keeping the movement controlled and your spine neutral. Avoid lifting your hips off the seat or arching your back.",,,Hamstrings,Legs,Knees,Gym,FALSE,Intermediate,5,03-04,08-12,60,Accessory,Hinge,Leg Curl Machine,Moderate,Main,,hamstring_curls,More Lower Body for Women,leg_extension
barbell_hip_thrust,Barbell Hip Thrust,"Sit on the floor with your upper back against a bench, knees bent, and feet flat on the ground, hip-width apart. Roll a barbell over your legs so it rests in the crease of your hips (use a pad for comfort). Engage your core and keep your chin tucked. Exhale as you drive through your heels, lifting your hips until your body forms a straight line from shoulders to knees, squeezing your glutes at the top. Inhale as you lower your hips back down with control, stopping just above the ground. Avoid overarching your lower back or letting your knees cave inward.",,,Glutes,Glutes,Lower Back,Gym,FALSE,Intermediate,6,03-04,08-12,60,Compound,Other,Barbell,Moderate,Main,,hip_thrust,More Lower Body for Women,
