id,name,instructions,videoUrl,image,muscleGroups,generalMuscleGroups,injuryRisks,category,isTimed,difficulty,caloriesPerMinute,setsRange,repsRange,restTimeSeconds,exerciseType,movementPattern,specificEquipment,targetIntensity,workoutPhase,recommendedDurationSeconds,minimumEquipmentAlternative,genderAdjustment,pairWith
goblet_squat,Goblet Squat,"Stand with your feet slightly wider than shoulder-width apart, toes slightly turned out, holding a dumbbell or kettlebell at chest level with both hands, elbows pointing down. Engage your core and keep your chest up. Inhale as you push your hips back and bend your knees, lowering into a squat until your thighs are at least parallel to the ground. Keep your knees tracking over your toes and your back straight. Exhale as you drive through your heels to stand back up, squeezing your glutes at the top. Avoid letting your knees cave inward or your chest collapse forward.",,assets/images/goblet_squat.jpg,Quads;Glutes,Legs;Glutes,Knees;Lower Back,dumbbells,FALSE,Intermediate,5,03-04,08-12,60,Compound,Squat,Dumbbells,Moderate,Main,,dumbbell_goblet_squat,More Lower Body for Women,hip_thrust
good_morning,Good Morning,"Stand with your feet shoulder-width apart, holding a barbell across your upper back (on your traps, not your neck), hands gripping the bar just outside your shoulders. Keep a slight bend in your knees and engage your core. Inhale as you hinge at your hips, pushing your hips back and lowering your torso until it’s nearly parallel to the ground, feeling a stretch in your hamstrings. Keep your back flat and neck neutral. Exhale as you drive your hips forward to return to the starting position, squeezing your glutes at the top. Avoid rounding your back or letting your knees bend excessively.",,assets/images/good_morning.jpg,Hamstrings;Glutes;Lower Back,Legs;Glutes;Back,Lower Back,Gym,FALSE,Intermediate,5,03-04,08-12,60,Compound,Hinge,Barbell,Moderate,Main,,good_morning_dumbbells,More Lower Body for Women,leg_press
hammer_curl,Hammer Curl,"Stand with your feet shoulder-width apart, holding a dumbbell in each hand by your sides, palms facing your body (neutral grip). Keep your elbows tucked into your torso and your shoulders relaxed. Exhale as you curl the dumbbells toward your shoulders, keeping your wrists neutral and focusing on contracting your biceps and forearms. Pause at the top, then inhale as you slowly lower the dumbbells back to the starting position with control. Avoid swinging the weights or using your shoulders to lift.",,assets/images/hammer_curl.jpg,Long Head Biceps;Forearms,Arms,Elbows,dumbbells,FALSE,Intermediate,5,03-04,08-12,60,Accessory,Pull,Dumbbells,Moderate,Accessory,,hammer_curls,Lighter Weight for Women,lying_tricep_extension
hammer_curls,Hammer Curls,"Stand with your feet shoulder-width apart, holding a dumbbell in each hand by your sides, palms facing your body (neutral grip). Keep your elbows tucked into your torso and your shoulders relaxed. Exhale as you curl the dumbbells toward your shoulders, keeping your wrists neutral and focusing on contracting your biceps and forearms. Pause at the top, then inhale as you slowly lower the dumbbells back to the starting position with control. Avoid swinging the weights or using your shoulders to lift.",,assets/images/hammer_curls.jpg,Long Head Biceps;Forearms,Arms,Elbows,dumbbells,FALSE,Intermediate,5,03-04,08-12,60,Accessory,Pull,Dumbbells,Moderate,Accessory,,hammer_curl,Lighter Weight for Women,lying_tricep_extension
hamstring_curl_machine,Hamstring Curl Machine,"Lie face down on a hamstring curl machine, adjusting the pad so it rests just above your heels, with your knees aligned with the machine’s pivot point. Grasp the handles for stability and keep your hips pressed into the bench. Engage your core and exhale as you curl the pad toward your glutes, squeezing your hamstrings at the top of the movement. Inhale as you slowly lower the pad back to the starting position, maintaining control. Avoid lifting your hips off the bench or arching your back.",,assets/images/hamstring_curl_machine.jpg,Hamstrings,Legs,Knees,Gym,FALSE,Intermediate,5,03-04,08-12,60,Accessory,Hinge,Leg Curl Machine,Moderate,Main,,hamstring_curls,More Lower Body for Women,leg_extension
hamstring_curls,Hamstring Curls,"Lie face down on a mat with a light dumbbell placed between your feet (or use bodyweight for a lighter variation). Keep your legs straight and engage your core. Exhale as you bend your knees, curling your heels toward your glutes and squeezing your hamstrings at the top. Inhale as you slowly lower your legs back to the starting position, maintaining control. Keep your hips pressed into the ground and avoid arching your back. If using a dumbbell, ensure it’s secure to avoid dropping it.",,assets/images/hamstring_curls.jpg,Hamstrings,Legs,Knees,dumbbells,FALSE,Intermediate,5,03-04,08-12,60,Accessory,Hinge,Dumbbells,Moderate,Main,,seated_leg_curl_machine,More Lower Body for Women,leg_extension
incline_barbell_press,Incline Barbell Press,"Set an incline bench to a 30-45 degree angle and lie back with your feet planted on the ground. Grasp a barbell with an overhand grip, hands slightly wider than shoulder-width. Unrack the bar and position it over your upper chest. Inhale to brace your core, then lower the bar to your upper chest, keeping your elbows at a 45-degree angle to your torso. Exhale as you press the bar back up to the starting position, focusing on your upper chest and shoulders. Keep your shoulder blades retracted and avoid locking your elbows at the top.",,assets/images/incline_barbell_press.jpg,Upper Chest;Front Shoulder;Triceps,Chest;Shoulders;Arms,Shoulders,Gym,FALSE,Intermediate,6,03-04,08-12,60,Compound,Push,Barbell;Bench,Moderate,Main,,incline_dumbbell_press,More Upper Body for Men,wide_grip_lat_pull_down
incline_dumbbell_curl,Incline Dumbbell Curl,"Set an incline bench to a 45-60 degree angle and sit with your back fully supported, feet flat on the floor. Hold a dumbbell in each hand, arms fully extended, palms facing up, and let your arms hang down behind your body. Keep your elbows close to your torso. Exhale as you curl the dumbbells toward your shoulders, focusing on squeezing your biceps and keeping your upper arms stationary. Inhale as you slowly lower the dumbbells back to the starting position, maintaining tension in your biceps. Avoid swinging the weights or letting your elbows flare out.",,assets/images/incline_dumbbell_curl.jpg,Long Head Biceps,Arms,Elbows,dumbbells,FALSE,Intermediate,5,03-04,08-12,60,Accessory,Pull,Dumbbells,Moderate,Accessory,,seated_dumbbell_bicep_curl,Lighter Weight for Women,seated_tricep_extension
incline_dumbbell_press,Incline Dumbbell Press,"Set an incline bench to a 30-45 degree angle and lie back with your feet planted on the ground, holding a dumbbell in each hand at shoulder height, palms facing forward. Position your elbows at a 45-degree angle to your torso, keeping your shoulder blades retracted. Exhale as you press the dumbbells straight up over your chest, bringing them close together at the top without locking your elbows. Inhale as you lower the dumbbells back to shoulder height with control, feeling a stretch in your upper chest. Avoid bouncing the weights or arching your back.",,assets/images/incline_dumbbell_press.jpg,Upper Chest;Front Shoulder;Triceps,Chest;Shoulders;Arms,Shoulders,dumbbells,FALSE,Intermediate,5,03-04,08-12,60,Compound,Push,Dumbbells,Moderate,Main,,incline_press,More Upper Body for Men,seated_cable_row
incline_press,Incline Press,"Set an incline bench to a 30-45 degree angle and lie back with your feet planted on the ground, holding a dumbbell in each hand at shoulder height, palms facing forward. Position your elbows at a 45-degree angle to your torso, keeping your shoulder blades retracted. Exhale as you press the dumbbells straight up over your chest, bringing them close together at the top without locking your elbows. Inhale as you lower the dumbbells back to shoulder height with control, feeling a stretch in your upper chest. Avoid bouncing the weights or arching your back.",,assets/images/incline_press.jpg,Upper Chest;Front Shoulder;Triceps,Chest;Shoulders;Arms,Shoulders,dumbbells,FALSE,Intermediate,5,03-04,08-12,60,Compound,Push,Dumbbells,Moderate,Main,,incline_dumbbell_press,More Upper Body for Men,seated_cable_row
incline_smith_machine_bench_press,Incline Smith Machine Bench Press,"Set an incline bench to a 30-45 degree angle inside a Smith machine. Lie back on the bench with your feet planted on the ground, and grasp the bar with an overhand grip, hands slightly wider than shoulder-width. Unrack the bar by rotating your wrists and position it over your upper chest. Inhale to brace your core, then lower the bar to your upper chest, keeping your elbows at a 45-degree angle to your torso. Exhale as you press the bar back up to the starting position, focusing on your upper chest. Avoid locking your elbows at the top or bouncing the bar.",,,Upper Chest;Triceps,Chest;Arms,Shoulders,Gym,FALSE,Intermediate,6,03-04,08-12,60,Compound,Push,Smith Machine,Moderate,Main,,incline_dumbbell_press,More Upper Body for Men,close_grip_lat_pull_down
lateral_raise,Lateral Raise,"Stand tall with your feet shoulder-width apart, holding a dumbbell in each hand by your sides, palms facing in. Engage your core and keep your shoulders relaxed. Exhale as you raise your arms out to the sides to shoulder height, keeping a slight bend in your elbows to avoid strain. Pause briefly at the top, then inhale as you lower the dumbbells back to your sides with control. Avoid swinging the weights or shrugging your shoulders toward your ears.",,assets/images/lateral_raise.jpg,Mid Shoulder,Shoulders,Shoulders,dumbbells,FALSE,Intermediate,5,03-04,08-12,60,Accessory,Push,Dumbbells,Moderate,Accessory,,lateral_raises,More Upper Body for Men,
lateral_raises,Lateral Raises,"Stand tall with your feet shoulder-width apart, holding a dumbbell in each hand by your sides, palms facing in. Engage your core and keep your shoulders relaxed. Exhale as you raise your arms out to the sides to shoulder height, keeping a slight bend in your elbows to avoid strain. Pause briefly at the top, then inhale as you lower the dumbbells back to your sides with control. Avoid swinging the weights or shrugging your shoulders toward your ears.",,assets/images/lateral_raises.jpg,Mid Shoulder,Shoulders,Shoulders,dumbbells,FALSE,Intermediate,5,03-04,08-12,60,Accessory,Push,Dumbbells,Moderate,Accessory,,lateral_raise,More Upper Body for Men,
leg_extension,Leg Extension,"Sit on a leg extension machine with your back against the pad and your shins under the padded bar, adjusting the machine so your knees align with the pivot point. Grasp the handles for stability and engage your core. Exhale as you extend your legs until they are almost straight, focusing on contracting your quads, but avoid locking your knees. Inhale as you slowly lower the weight back to the starting position, keeping the movement controlled. Keep your back against the pad and avoid using momentum to lift the weight.",,assets/images/leg_extension.jpg,Quads,Legs,Knees,Gym,FALSE,Intermediate,5,03-04,08-12,60,Accessory,Squat,Leg Extension Machine,Moderate,Main,,seated_leg_press,More Lower Body for Women,hamstring_curl_machine
leg_press,Leg Press,"Sit on a leg press machine with your back and hips against the seat, feet shoulder-width apart on the platform, toes slightly turned out. Adjust the seat so your knees are at a 90-degree angle. Grasp the handles for stability and engage your core. Exhale as you press through your heels to extend your legs, stopping just before locking your knees. Inhale as you slowly lower the platform back down until your knees are at a 90-degree angle again. Keep your hips and back against the seat and avoid rounding your lower back.",,assets/images/leg_press.jpg,Quads;Glutes,Legs;Glutes,Knees;Lower Back,Gym,FALSE,Intermediate,6,03-04,08-12,60,Compound,Squat,Leg Press Machine,Moderate,Main,,seated_leg_press,More Lower Body for Women,good_morning_dumbbells
leg_press_calve_raises,Leg Press Calve Raises,"Sit on a leg press machine with your back against the seat, placing the balls of your feet on the lower edge of the platform, heels hanging off, and legs straight but not locked. Grasp the handles for stability. Exhale as you press the platform away by pointing your toes, flexing your calves at the top of the movement. Inhale as you lower the platform by letting your heels drop slightly, feeling a stretch in your calves. Keep the movement controlled and avoid bouncing.",,https://firebasestorage.googleapis.com/v0/b/cashfit-2800f.firebasestorage.app/o/uploads%2F1000012039.jpg?alt=media&token=40df03aa-e538-4795-9e52-581b65785549,Calves,Legs,Ankles,Gym,FALSE,Intermediate,5,03-04,08-12,60,Accessory,Other,Leg Press Machine,Moderate,Accessory,,standing_calf_raises,None,
machine_shoulder_press,Machine Shoulder Press,"Sit on a shoulder press machine with your back against the pad, feet flat on the floor, and hands grasping the handles at shoulder height, palms facing forward. Adjust the seat so the handles are at shoulder level. Engage your core and keep your chest up. Exhale as you press the handles upward until your arms are fully extended but not locked out. Inhale as you lower the handles back to the starting position with control. Avoid shrugging your shoulders or arching your back during the movement.",,assets/images/machine_shoulder_press.jpg,Front Shoulder;Mid Shoulder,Shoulders;Arms,Shoulders,Gym,FALSE,Intermediate,6,03-04,08-12,60,Compound,Push,Shoulder Press Machine,Moderate,Main,,seated_dumbbell_shoulder_press,More Upper Body for Men,seated_cable_row
ez_bar_front_raise,EZ Bar Front Raise,"Stand with your feet shoulder-width apart, holding an EZ bar in front of your thighs with an overhand grip, hands shoulder-width apart. Engage your core and keep your shoulders relaxed. Exhale as you raise the bar straight in front of you to shoulder height, keeping your arms straight with a slight bend in your elbows. Pause briefly at the top, then inhale as you lower the bar back to the starting position with control. Avoid swinging the bar or leaning back to lift.",,,Front Shoulder,Shoulders,Shoulders,Gym,FALSE,Intermediate,5,03-04,08-12,60,Accessory,Push,EZ Bar,Moderate,Accessory,,front_dumbbell_raise,More Upper Body for Men,
overhead_dumbbell_extension,Overhead Dumbbell Extension,"Sit on a bench with your feet flat on the floor, holding a dumbbell with both hands by gripping the handle, palms facing up. Lift the dumbbell overhead so your arms are fully extended, keeping your elbows close to your head. Engage your core to avoid arching your back. Inhale as you lower the dumbbell behind your head by bending your elbows, keeping your upper arms stationary. Lower until your forearms are parallel to the ground, then exhale as you extend your arms back to the starting position, fully contracting your triceps. Avoid flaring your elbows out or locking your elbows at the top.",,,Long Head Triceps;Lateral Head Triceps,Arms,Elbows,dumbbells,FALSE,Intermediate,5,03-04,08-12,60,Accessory,Push,Dumbbells,Moderate,Accessory,,seated_tricep_extension,More Upper Body for Men,incline_dumbbell_curl
plank,Plank,"Start in a forearm plank position with your elbows directly under your shoulders, forearms on the ground, and body in a straight line from head to heels. Engage your core by pulling your belly button toward your spine, and squeeze your glutes to stabilize your hips. Keep your neck neutral by looking at the floor just ahead of you. Hold this position, breathing steadily, without letting your hips sag or pike up. For a regression, drop to your knees while keeping your body straight.",,assets/images/plank.jpg,Upper Abs;Lower Abs;Obliques,Core,Lower Back,Bodyweight,TRUE,Intermediate,4,03-04,30-45,60,Accessory,Other,Bodyweight,Moderate,Accessory,30-45,side_plank,None,
preacher_curl,Preacher Curl,"Sit on a preacher curl bench with your upper arms resting on the pad, holding an EZ bar or barbell with an underhand grip, hands shoulder-width apart. Adjust the seat so your armpits are just above the pad. Engage your core and keep your shoulders relaxed. Exhale as you curl the bar toward your shoulders, focusing on squeezing your biceps and keeping your upper arms pressed into the pad. Pause at the top, then inhale as you slowly lower the bar back to the starting position, maintaining tension in your biceps. Avoid using your shoulders or back to lift the weight.",,,Short Head Biceps,Arms,Elbows,Gym,FALSE,Intermediate,5,03-04,08-12,60,Accessory,Pull,EZ Bar,Moderate,Accessory,,machine_preacher_curl,Lighter Weight for Women,overhead_rope_extension
pull_ups,Pull Ups,"Hang from a pull-up bar with an overhand grip, hands slightly wider than shoulder-width apart, arms fully extended. Engage your core and squeeze your glutes to stabilize your body. Pull your shoulder blades down and back to initiate the movement. Exhale as you pull your body up, driving your elbows down until your chin is above the bar and your lats are fully contracted. Inhale as you slowly lower yourself back to the starting position, maintaining control. Avoid swinging your body or kipping to use momentum.",,assets/images/pull_ups.jpg,Lats;Upper Back,Back,Shoulders,Gym,FALSE,Advanced,6,04-May,06-10,90,Compound,Pull,Pull-Up Bar,High,Main,,chin_ups,More Upper Body for Men,12line_bench_press
push_ups,Push Ups,"Start in a high plank position with your hands shoulder-width apart, directly under your shoulders, and body in a straight line from head to heels. Engage your core and squeeze your glutes to stabilize your body. Inhale as you lower your chest toward the ground, keeping your elbows at a 45-degree angle to your torso. Exhale as you push back up to the starting position, fully extending your arms. Avoid letting your hips sag or your shoulders shrug. For a regression, drop to your knees while keeping your body straight.",,assets/images/push_ups.jpg,Mid Chest;Triceps,Chest;Arms,Wrists;Shoulders,Bodyweight,FALSE,Intermediate,4,03-04,08-12,60,Compound,Push,Bodyweight,Moderate,Main,,incline_push_ups,More Upper Body for Men,towel_row
reverse_fly_dumbbells,Reverse Fly Dumbbells,"Stand with your feet shoulder-width apart, holding a dumbbell in each hand, palms facing each other. Hinge at your hips to lean forward slightly, keeping your back flat and core engaged, with the dumbbells hanging below your chest. Exhale as you raise the dumbbells out to the sides in a wide arc, squeezing your rear delts and upper back at the top, until your arms are parallel to the ground. Inhale as you lower the dumbbells back to the starting position with control. Keep a slight bend in your elbows and avoid shrugging your shoulders.",,,Rear Shoulder;Upper Back,Shoulders;Back,Shoulders,dumbbells,FALSE,Intermediate,5,03-04,08-12,60,Accessory,Pull,Dumbbells,Moderate,Accessory,,cable_reverse_fly,More Upper Body for Men,dumbbell_fly
romanian_deadlift,Romanian Deadlift,"Stand with your feet shoulder-width apart, holding a barbell in front of your thighs with an overhand grip, hands shoulder-width apart. Keep a slight bend in your knees and engage your core. Inhale as you hinge at your hips, pushing your hips back and lowering the barbell toward the ground, keeping it close to your legs. Lower until you feel a stretch in your hamstrings, keeping your back flat and chest up. Exhale as you drive through your heels to stand back up, squeezing your glutes at the top. Avoid rounding your back or letting the bar drift forward.",,assets/images/romanian_deadlift.jpg,Hamstrings;Glutes;Lower Back,Legs;Glutes;Back,Lower Back,Gym,FALSE,Intermediate,6,03-04,08-12,60,Compound,Hinge,Barbell,Moderate,Main,,romanian_deadlift_dumbbells,More Lower Body for Women,leg_press
romanian_deadlift_dumbbells,Romanian Deadlift Dumbbells,"Stand with your feet shoulder-width apart, holding a dumbbell in each hand in front of your thighs, palms facing your body. Keep a slight bend in your knees and engage your core. Inhale as you hinge at your hips, pushing your hips back and lowering the dumbbells toward the ground, keeping them close to your legs. Lower until you feel a stretch in your hamstrings, keeping your back flat and chest up. Exhale as you drive through your heels to stand back up, squeezing your glutes at the top. Avoid rounding your back or letting the dumbbells drift forward.",,,Hamstrings;Glutes;Lower Back,Legs;Glutes;Back,Lower Back,dumbbells,FALSE,Intermediate,5,03-04,08-12,60,Compound,Hinge,Dumbbells,Moderate,Main,,dumbbell_deadlift,More Lower Body for Women,leg_press
seated_cable_row,Seated Cable Row,"Sit at a cable row machine with your feet on the footrests, knees slightly bent, and grasp the handle (V-bar or wide bar) with both hands. Sit upright with your back straight and engage your core. Exhale as you pull the handle toward your lower chest, driving your elbows back and squeezing your shoulder blades together. Keep your torso stationary and avoid leaning back excessively. Inhale as you slowly extend your arms back to the starting position, maintaining control. Avoid shrugging your shoulders or using your biceps to pull.",,assets/images/seated_cable_row.jpg,Lats;Mid Back,Back,Shoulders,Gym,FALSE,Intermediate,6,03-04,08-12,60,Compound,Pull,Cable,Moderate,Main,,chest_supported_dumbbell_row,More Upper Body for Men,cable_chest_press
seated_dumbbell_bicep_curl,Seated Dumbbell Bicep Curl,"Sit on a bench with your feet flat on the floor, holding a dumbbell in each hand, arms by your sides, palms facing forward. Keep your back straight and elbows tucked into your torso. Exhale as you curl the dumbbells toward your shoulders, focusing on squeezing your biceps and keeping your upper arms stationary. Pause at the top, then inhale as you slowly lower the dumbbells back to the starting position, maintaining control. Avoid swinging the weights or using your shoulders to lift.",,,Long Head Biceps;Short Head Biceps,Arms,Elbows,dumbbells,FALSE,Intermediate,5,03-04,08-12,60,Accessory,Pull,Dumbbells,Moderate,Accessory,,bicep_dumbbell_curls,Lighter Weight for Women,seated_tricep_extension
seated_dumbbell_row,Seated Dumbbell Row,"Sit on a bench with your feet flat on the floor, holding a dumbbell in each hand, palms facing each other. Lean forward slightly at your hips, keeping your back flat and core engaged, with the dumbbells hanging below your chest. Exhale as you row the dumbbells up toward your waist, driving your elbows back and squeezing your upper back. Inhale as you lower the dumbbells back to the starting position with control. Avoid shrugging your shoulders or using your biceps excessively.",,,Lats;Mid Back,Back,Shoulders,dumbbells,FALSE,Intermediate,5,03-04,08-12,60,Compound,Pull,Dumbbells,Moderate,Main,,single_arm_dumbbell_row,More Upper Body for Men,dumbbell_chest_press
seated_dumbbell_shoulder_press,Seated Dumbbell Shoulder Press,"Set an adjustable bench to a 90-degree angle and sit with your back fully supported, feet flat on the floor. Hold a dumbbell in each hand at shoulder height, palms facing forward, elbows bent at 90 degrees and pointing downward. Engage your core and keep your chest up. Exhale as you press the dumbbells overhead, bringing them close together at the top without locking your elbows. Inhale as you lower the dumbbells back to shoulder height, keeping your elbows at a 45-degree angle to your torso. Avoid shrugging your shoulders or arching your back during the movement.",,,Front Shoulder;Mid Shoulder,Shoulders,Shoulders,dumbbells,FALSE,Intermediate,6,03-04,08-12,60,Compound,Push,Dumbbells,Moderate,Main,,machine_shoulder_press,More Upper Body for Men,chest_supported_dumbbell_row
seated_leg_press,Seated Leg Press,"Sit on a seated leg press machine with your back against the pad, feet shoulder-width apart on the platform, toes slightly turned out. Adjust the seat so your knees are at a 90-degree angle. Grasp the handles for stability and engage your core. Exhale as you press the platform away, extending your legs until they are almost straight, but avoid locking your knees. Inhale as you slowly lower the platform back to the starting position, keeping your hips and back against the seat. Avoid rounding your lower back or lifting your hips off the seat.",,,Quads;Glutes,Legs;Glutes,Knees;Lower Back,Gym,FALSE,Intermediate,6,03-04,08-12,60,Compound,Squat,Leg Press Machine,Moderate,Main,,leg_press,More Lower Body for Women,good_morning_dumbbells
seated_machine_chest_press,Seated Machine Chest Press,"Sit on a chest press machine with your back against the pad, feet flat on the floor, and hands grasping the handles at chest height, palms facing forward. Adjust the seat so the handles are at mid-chest level. Engage your core and keep your shoulder blades retracted. Exhale as you press the handles forward until your arms are fully extended but not locked out. Inhale as you slowly return the handles to the starting position, feeling a stretch in your chest. Avoid shrugging your shoulders or arching your back during the movement.",,,Mid Chest;Triceps,Chest;Arms,Shoulders,Gym,FALSE,Intermediate,6,03-04,08-12,60,Compound,Push,Chest Press Machine,Moderate,Main,,cable_chest_press,More Upper Body for Men,seated_cable_row
